{
  "style": "renaissance-revival-american",
  "style_name": "Renaissance Revival (American)",
  "ontology_version": "0.7.0",
  "kit_version": "0.2.1",
  "slots": {
    "composition_parti": {
      "group": "massing-and-roof",
      "binding": "extends",
      "variants": [
        {
          "id": "astylar-symmetrical-palazzo",
          "status": "canonical",
          "op": "add"
        },
        {
          "id": "picturesque-asymmetrical",
          "status": "forbidden",
          "op": "add",
          "note": "massing_affinities: 'picturesque irregularity destroys the only compositional rule the style has.'"
        }
      ],
      "rule_append": "Renaissance Revival is on the strict-bilateral institutional side of the family's split (c01): the principal elevation is exactly symmetrical about the entrance axis, with no projecting bay, tower, or wing permitted to break it.",
      "confidence": "high",
      "status": "drafted"
    },
    "roof_form": {
      "group": "massing-and-roof",
      "binding": "open",
      "variants": [],
      "parameters": {},
      "status": "empty"
    },
    "roof_pitch": {
      "group": "massing-and-roof",
      "binding": "open",
      "variants": [],
      "parameters": {},
      "status": "empty"
    },
    "roof_material": {
      "group": "massing-and-roof",
      "binding": "open",
      "variants": [],
      "parameters": {},
      "status": "empty"
    },
    "eave_condition": {
      "group": "massing-and-roof",
      "binding": "specified",
      "variants": [
        {
          "id": "modillion-dentil-cornice-terminated",
          "status": "canonical"
        },
        {
          "id": "wide-bracketed-eave",
          "status": "forbidden",
          "note": "Diagnostic tell: sawn brackets, not modillions or dentils, signal Italianate, not Renaissance Revival."
        }
      ],
      "determined_by": [
        "cornice"
      ],
      "rule": "The eave is terminated by the modillioned or dentilled crowning cornice, never by sawn brackets — the fastest distinguishing tell against Italianate.",
      "confidence": "high",
      "status": "drafted"
    },
    "rake_condition": {
      "group": "massing-and-roof",
      "binding": "open",
      "variants": [],
      "parameters": {},
      "status": "empty"
    },
    "cornice_return": {
      "group": "massing-and-roof",
      "binding": "forbidden",
      "rule": "No cornice return: the crowning cornice runs unbroken across the full width of the facade and across party walls.",
      "status": "drafted",
      "confidence": "medium",
      "judgment": true,
      "note": "BOUND 30 Sep 2026 (WP-16.2), on Lucas's answer A4 of 30 Sep 2026, recorded in oq/an-inherited-ban-decides-what-the-elevation-may-draw (WP-16.2 stage 2): each of the Italianate family binds its own cornice return forbidden, on its own roof. Until then it was forbidden by GOTHIC-REVIVAL-AMERICAN, on 'The rake is finished in bargeboard, not a boxed classical cornice with mitred returns; a cornice return signals Greek Revival millwork, not Gothic Revival (see distinguished_from).' -- a bargeboarded rake, which is not this style's. This record states no roof form and no gable; its cornice is a party-wall cornice: c03 reads 'shall run unbroken across the full width of the facade, including across party walls in a row.' Marked judgment, because the record names no gable end and the ban is read from the cornice it does state."
    },
    "gable_treatment": {
      "group": "massing-and-roof",
      "binding": "open",
      "variants": [],
      "parameters": {},
      "status": "empty"
    },
    "dormer": {
      "group": "massing-and-roof",
      "binding": "open",
      "variants": [],
      "parameters": {},
      "status": "empty"
    },
    "chimney": {
      "group": "massing-and-roof",
      "binding": "open",
      "variants": [],
      "parameters": {},
      "status": "empty"
    },
    "roof_penetration_rules": {
      "group": "massing-and-roof",
      "binding": "open",
      "variants": [],
      "parameters": {},
      "status": "empty"
    },
    "height_proportion": {
      "group": "massing-and-roof",
      "binding": "specified",
      "parameters": {
        "storey_diminish_pct": {
          "range": [
            12,
            22
          ],
          "unit": "percent",
          "kind": "measured",
          "note": "Equivalent to c02's 'each storey 78 to 88 percent of the one below', restated as diminish-percentage."
        },
        "piano_nobile_min_ratio": {
          "value": 1.15,
          "unit": "ratio",
          "kind": "measured",
          "note": "c02."
        },
        "rusticated_base_ratio": {
          "range": [
            0.8,
            1.0
          ],
          "unit": "ratio",
          "kind": "measured"
        }
      },
      "rule": "Floor-to-floor heights diminish monotonically upward, each storey between 78 and 88 percent of the one below, with the piano nobile at least 1.15 times the storey above it (c02). 'The only style in this branch that is' genuinely proportional in the storey-height sense.",
      "packs": [
        {
          "pack": "storey-graduation",
          "precedence": 1
        }
      ],
      "confidence": "high",
      "status": "drafted"
    },
    "wing_strategy": {
      "group": "massing-and-roof",
      "binding": "open",
      "variants": [],
      "parameters": {},
      "status": "empty"
    },
    "construction_type": {
      "group": "envelope",
      "binding": "extends",
      "variants": [
        {
          "id": "balloon-frame",
          "status": "forbidden",
          "op": "replace",
          "note": "Defining_characteristics, verbatim: 'a wooden Renaissance Revival is a contradiction.'"
        },
        {
          "id": "braced-timber-frame",
          "status": "forbidden",
          "op": "replace",
          "note": "Same fact; no wood-frame register exists for this style."
        },
        {
          "id": "solid-masonry-two-wythe",
          "status": "canonical",
          "op": "replace"
        },
        {
          "id": "solid-masonry-three-wythe",
          "status": "canonical",
          "op": "replace"
        }
      ],
      "rule_append": "Masonry only: ashlar, brownstone, pressed brick, or cast iron. Every frame variant the family otherwise permits is forbidden here.",
      "confidence": "high",
      "status": "drafted"
    },
    "wall_thickness_masonry": {
      "group": "envelope",
      "binding": "open",
      "status": "empty"
    },
    "wall_thickness_frame": {
      "group": "envelope",
      "binding": "open",
      "status": "empty"
    },
    "primary_cladding": {
      "group": "envelope",
      "binding": "specified",
      "variants": [
        {
          "id": "brownstone-ashlar",
          "status": "canonical"
        },
        {
          "id": "pressed-brick",
          "status": "permitted"
        },
        {
          "id": "cast-iron-front",
          "status": "permitted",
          "note": "The commercial register: 'a catalogue of columns, arches, spandrels, and cornices, orderable by number, assembled in weeks.'"
        },
        {
          "id": "clapboard",
          "status": "forbidden",
          "note": "Defining_characteristics, verbatim: 'a wooden Renaissance Revival is a contradiction.'"
        },
        {
          "id": "board-and-batten-vertical",
          "status": "forbidden",
          "note": "Same: no wood cladding of any kind in this masonry style."
        }
      ],
      "rule": "Ashlar, brownstone, pressed brick, or cast iron; a wooden Renaissance Revival is a contradiction.",
      "confidence": "high",
      "status": "drafted"
    },
    "secondary_cladding": {
      "group": "envelope",
      "binding": "open",
      "variants": [],
      "parameters": {},
      "status": "empty"
    },
    "material_change_rule": {
      "group": "envelope",
      "binding": "open",
      "variants": [],
      "parameters": {},
      "status": "empty"
    },
    "foundation_expression": {
      "group": "envelope",
      "binding": "open",
      "variants": [],
      "parameters": {},
      "status": "empty"
    },
    "water_table": {
      "group": "envelope",
      "binding": "open",
      "variants": [],
      "parameters": {},
      "status": "empty"
    },
    "belt_course": {
      "group": "envelope",
      "binding": "specified",
      "variants": [
        {
          "id": "string-course-flat-wall",
          "status": "canonical"
        }
      ],
      "rule": "Flat, uninterrupted wall plane articulated by string courses and quoins rather than by projection.",
      "confidence": "high",
      "status": "drafted"
    },
    "corner_quoin": {
      "group": "envelope",
      "binding": "specified",
      "variants": [
        {
          "id": "full-height-alternating-quoin",
          "status": "canonical"
        },
        {
          "id": "partial-height-decorative-quoin",
          "status": "forbidden",
          "note": "c05."
        }
      ],
      "parameters": {
        "quoin_face_length_in": {
          "range": [
            18,
            30
          ],
          "unit": "in",
          "kind": "measured"
        }
      },
      "rule": "Quoins run the full height of the corner from water table to cornice in an unbroken alternating rhythm, long faces 18 to 30 in. Partial-height or purely decorative quoining is prohibited (c05).",
      "confidence": "high",
      "status": "drafted"
    },
    "corner_board": {
      "group": "envelope",
      "binding": "open",
      "variants": [],
      "parameters": {},
      "status": "empty"
    },
    "expressed_frame": {
      "group": "envelope",
      "binding": "open",
      "status": "empty"
    },
    "reveal_masonry": {
      "group": "envelope",
      "binding": "open",
      "variants": [],
      "parameters": {},
      "status": "empty"
    },
    "reveal_frame": {